<?xml version="1.0" encoding="UTF-8" ?>
<xs:schema
        xmlns:xs="http://www.w3.org/2001/XMLSchema"
        targetNamespace="https://ahmedsameh_lab2_task1"
        xmlns="https://ahmedsameh_lab2_task1"
        elementFormDefault="qualified">
    <xs:element name="BookStore">
        <xs:complexType>
            <xs:sequence>
                <xs:element name="Book" minOccurs="1" maxOccurs="unbounded">
                    <xs:complexType>
                        <xs:sequence>
                            <xs:element name="title" type="xs:string"/>
                            <xs:element name="author" type="xs:string"/>
                            <xs:element name="date" type="xs:date"/>
                            <xs:element name="ISBN" type="xs:int"/>
                            <xs:element name="publisher" type="xs:string"/>
                        </xs:sequence>
                    </xs:complexType>
                </xs:element>
            </xs:sequence>
        </xs:complexType>
    </xs:element>


</xs:schema>